restaurant_name,number,review
Taco Bell,12,I will preface this by saying that we know it s a Taco Bell and what that gets you. However  I thought it would get me more than one ounce of nacho cheese in a two-ounce cup.   When we brought this to the manager s attention  along with the missing chips and taco -- all of which were flattened and stale   they said it was standard to serve the container half full.   They replaced the missing items but only a after they refused to give a refund as we no longer wanted the subpar food. We will be giving our patronage to Taco Cabana from now on.
Taco Bell,13,I ordered cinnamon twist with my order. I didn t get them. I asked for hot sauce. Didn t get any. Not even 1 napkin to accompany my food. Now  I m home with an upset child because I promised her cinnamon twist. Thanks guys  Oh  and it was not even close to be being busy.
Taco Bell,14,So I went to the store to redeem a coupon and for a supreme no crunchy taco I ended up getting a regular taco but I guess they re trying to trick me so they could save a few cents here and there they wrapped it up in a supreme taco wrapper put it in the bag and sent me on my way I don t appreciate the trickery involved of miss labeling the taco just to get me him through the window I ll talk to the mail store manager of which didn t resolve anything I ended up calling corporate office will see what they do I would take note for the lack of star positive star readings at most Taco Bell s get because there are definite lack of any professional customer service if that Taco BellIs the Toria s for it s over seasoned beef small portions and lack of customer service
Taco Bell,15,Rude slow morons work the night shift here.  Don t order online  There s no point they just wait til you get there anyway.
Taco Bell,16,They were out of nacho cheese.  No big deal I say.    Go ahead and just put shredded cheese on the 3 items.   They told me they would have to upcharge the difference for EVERY single item in my order.  Are you ____ing kidding me.  You want me to pay for Erica the manager s mistake.  It s not our fault you re out of cheese  Erica        The nerve.  This place is now the worst ever.  Ridiculous        I ll never go back  and with so many Taco Bells in the area...you shouldn t waste your time or money 
Taco Bell,17,Went to eat lunch at the E Anderson location and when we received our food we noticed our Mexican pizza had red hair on top of it. I went inside to let the manager know what was found on the pizza  only to find out it was the Manager s hair that was in our food. I asked to speak with the manager  Erica  and she yells out she would not be speaking with me as if my hair was found in her food    As she is wrapping her hair in a bun and putting a hair net over the bun . Jose who was working the window comes to the front and says very rudely he is the manager and no one had time to speak with me   after I was told ERICA WAS THE MANAGER   I then ask if I could have a number to someone over Erica and Jose  Jose gave me a number  the wrong number  to Ana. I then googled the main office and received a call back from ANA only to find out it was the wrong number 
Taco Bell,18,It s Taco Bell so you already know to adjust expectations. Is the food prepared reasonably well and served in the proper temperature  If so  they pass. Unfortunately  there have been numerous times when the food has not been heated up properly so loss of marks there. I will say however  that the professional behavior by the staff at this location is really warm and welcoming every-time I have gone inside this location. Truly a pleasant surprise 
Taco Bell,19,Went there for lunch last Wednesday  the three tacos I ordered had 1 4 of the toppings that they should have. The portions have gotten tiny.  I ve eaten there for years and never had a problem. I suppose a new manager is in charge and trying to increase profits.
Taco Bell,20,This place is normally good. But lately the quality is getting lower. I ordered tacos and 3 Burritos and all my tacos are broken on the bottoms  and tasted like they been sitting out all day. They really need to work on there quality control. I m not happy about wasting 20 
Taco Bell,21,So I keep my expectations pretty low when it comes to any Taco Bell in America  mostly because its really hard to mess things up but for some reason the people here have no idea what they re doing. Taco Bell is one of those fast food chains that can make most things with beans instead of beef but somehow the people here always get my order wrong  which is tough because I am vegetarian. Every single order I get I always have to recheck  and then go back in or drive thru again so they can replace it. This is so stupid because I always get my order to go  why should I have to double it all the time    Someones being incredibly lazy here. The only reason I didn t give it one star is because they gave me free desserts one night for messing up my order.
Taco Bell,22,This is the worst Taco Bell I have ever been to. Some of the female staff are ghetto and incompetent. The female manager acts like she can t control her employees. I will no longer be going to this specific location. And yet fast food people want  15 hr give me a break you don t deserve it if you have a nasty attitude. Oh and I recently went to this location and I recorded the customer service and a fat woman sitting on her behind was texting and asked me why am I recording her and that she was doing her job. First off  you have the right to record anyone in a public area read the laws and second she should have went elsewhere where she couldn t be seen if she wanted to sit on her behind and text on her phone. Nothing but unprofessional people that work here 
Taco Bell,23,I gave them one more star. Come on  the lady was trying hard and she doesn t have to take her job seriously  you know. They were also fast  although I did get there early. I tried The Nacho Fries Bell Grande. A taste double dare  I don t think so. I eat out too much. I ll probably end up going for another wack at it  as well as the smaller Nacho Fries. It was good  though. I just keep waiting for the burger places to come up with a hot dog burger or something.
Taco Bell,24,You know that Taco Bell is hit or miss.   I rarely go to Taco Bell. I have been twice in 6 months and both times my order was missing an item. On 08 18 16 at 12 00PM the teller enters the order correctly  the line making the food not only forget an item again  the food was also poorly made. When you don t care than no care is taken when making the food. I will not be back to this location. I think the consensus is in. This location is not worth your time. Unless you don t care than this is the location for you 
Taco Bell,25,Showed up at 8pm and they said they were not taking orders. Staff was just hanging out in the drive through. Will never come back. Person in the drive through was rude and condescending.
Taco Bell,26,Best tacobell around. Gave me a coupon for a free biscuit taco on Cinco de Mayo. They are kind of stingy with the fire sauce packets. You gotta ask for salsa and syrup for your waffle taco  see pic  . I AM A BREAKFAST DEFECTOR  
Taco Bell,27,Told me they had run out of beans at midnight.  Closes at 1am.  Just went by another Taco Bell and asked if this is even possible..   They told me unequivocally NO.  Beef yes  but they d have it restocked within the hour.  I thought I smelled something fishy with this.  Many years going to this location and you have to guess which end of the burrito has the sauce.  I got complacent..or lazy.  Went to Taco Bell a week ago in Cedar Park and that told me just how good this food should be.  Sauce end to end  fresh tasting etc.  I m not sure how you get so bad at making such basic food as the 183 Norwood Park location has gotten  or been  but it is dumbfounding.  DO NOT EAT at this location.
Taco Bell,28,Drive thru order. Quick and easy. Cashier was on point. Wasn t constantly asking if I wanted anything else. In and out in 43 seconds.
Taco Bell,29,First if they were out of nacho fries. Then the credit card machine declined my card twice  So then after being on hold for fifteen minutes with my bank  they tell me my card is fine. It s taco Bell machines. The tables were dirty. I had to ask for a straw  and napkins because they weren t stocked. I don t suggest going here.
Taco Bell,30,I love Taco Bell  but this location frequently doesn t open on time  and if they even acknowledge your existence it s with an annoyed  we re not ready yet . It s about a 50 50 chance you can grab some breakfast in between 7 and 7 30am  they open at 7  supposedly . On top of that  they may be out of sauce at that time somehow. Pretty disorganized in the morning.
Taco Bell,31,I just had an excellent experience at this location. It was clean and well stocked but the best part was the woman running the register. Her name is Donna and she greeted every customer brightly  made sure everyone got their orders and anything else they may need  and had a generally pleasant and welcoming demeanor. She alone would make me return to this particular store.
Taco Bell,32,You have got to be kidding me   Wrong ordered like holy crap  My fianc  had to drive back to get it figured out  and still came home with the wrong food    It s not a hard job  Screw this location  we both work in the food industry  but if a manager can t get things right  then someone needs to get fired  It s fast food  Wtf   Is all I need to say  Corporate look into this location  We will not be back  It s Texas so many other options around especially for Mexican food              Not to mention your system sucks as well probably because all of your complaints at the moment  and don t think I won t say something to corporate they will hear from me 
Taco Bell,33,Your standard Taco Bell  although this one did not give me food poisoning. Bonus  This place is good for what it is - Taco Bell.   Their customer service is quick and efficient  at least at the drive-thru . No complaints 
Taco Bell,34,I seldom write reviews. Mostly because I m easily satisfied and my bar for customer service is pretty low. I ve given this particular taco bell multiple chances and every single time they have let me down. I m writing this review because of my visit today was probably the worst I ve had.    I walk into this chaos erupting between a worker there and her apparent grandchildren. She is losing a lung screaming at them and bounces back and forth between being inside and outside. I feel   well  this is okay  everyone has a crazy family  sure.  So I try to order and I m told to wait because they for some reason don t have a drawer open at 5 PM. I wait about ten minutes and suffer through more exchanges between grandma and her grandkids and the whole time there is another worker looking at me apologetically.  I m still on board  this is fine and I can wait.  Enter these two old ladies  they come in and sprawl around looking at the menu and don t even mind my existence  despite being first in line. They warm up to grandma worker and make small talk and give out their order and I look at the other worker and I look at grandma and it s decided that it s fine that customers are allowed to cut in line.   Look  I realize that Taco Bell isn t some last bastion of customer service and nor should it be  I believe they are aware of what they re peddling  a greasy scummy treat that you give yourself to scratch a certain unexplainable itch. I m absolutely done with this particular Taco Bell and I think I m done with the franchise as a whole.   TL DR  this taco bell sucks and don t bother. Travel the extra little bit and go to Arby s down the road for trashy fast food.
Taco Bell,35,The guy who took our order was a total bro. I told him I d write a good review on yelp for his outstanding bro-ness  and goddammit thats what im going to do.  Allow me to paint you a picture.   Austin  Texas.  1 15 am.  Approximately 4.5 million degrees.   The sound of cicadas and unnervingly-close gunfire permeate the torrid night air.  Contrary to what television and those stupid pictures you see every ten seconds on facebook would have you believe  one can not buy groceries with swag  which we have in nearly criminal amounts  thus our apartment is nearly devoid of all food.   After about a week of failed attempts at finding ways to cook and eat swag  we decided we better eat something tangible  as the hunger hallucinations seemed to be getting worse by the hour.  We braved the gunfire and bird-sized flying insects and made a frantic  flailing sprint to our vehicle.  Safely  thanks for asking.  We arrived at this Taco Bell  emaciated and disoriented  but alive  having survived on the a fore mentioned swag alone.  The man taking our order was very patient as we struggled through the daunting task of trying to order tacos while hiding hungerections caused by the excitement of being so close to real food for the first time in weeks. If that sounds awkward to you  try being in the car at the time. Moving on.  Minutes  or possibly hours  later  we successfully communicated our desires to the magic food dispensing talking box  which told us to drive up to the window.   The guy at the window was incredibly friendly  and I briefly considered asking him to be my super best friend  but I then felt that may have been too much of a commitment this early into the relationship. Baby steps.  He told us our total  and with doe eyes we held out a wad of crumpled bills and some sweaty coins and asked if this was enough to make our stomach hurts go away.   Yes.  he said  voice shaking ever so slightly.  Yes it is.   and cupping his hands together  collected our humble offerings  disappearing into the fluorescent food  palace of salvation.  It was at this moment that I noticed the huge poster in the window of the Doritos Locos Taco  and because I have the mind of a child  I m all  Oh hellz yeah  gotta get me some of that shit    So as our Mighty Taco Lord came back to give us our change  I ordered one of those too. He wasn t annoyed at this in the slightest  suggesting that either he has kids  or maybe he s actually  for realzies  Jesus. I m thinking Jesus  because not only did he get me that taco...he said it was on the house  if I just did him a solid and took some survey.   I think thats how Scientoligists get people  but whatever  free taco   Our order  including my last minute addition  were made exactly as we asked. No tomatoes on my taco  no ice in our drink  everything was perfect. Not only is Taco Jesus super nice  he s also a good listener  ladies .  Not only was everything made to perfection  it was also ready very quickly. Like  seriously. Ninja fast. Everything was done before we even knew it started  uhh...ladies    So would I recommend this place  I d recommend you thank it for making sunny days and pretty girls every night before you go to bed  fool.  I hope Taco Jesus the Mega Bro reads this so he understands the difference being nice to one person can make. I wish I would ve remembered your name  dude.   P.S. That was my first Doritos Locos taco and it was fucking amazing.   --Stay Rad                                                                                                  Charlie Spleen
Taco Bell,36,Donna is the best cashier server I ve ever experienced in fast food. She is energetic  smiles  acknowledges customers and really shows passion in her job. Kudos more could learn from her.
Taco Bell,37,This is the closest taco bell to my house and it is open late so it is the natural choice to head here when I am heading home from the bars and need something to soak up the drink.   It s cheap  it s fast  it s Taco Bell. That s really all you need to know.
Taco Bell,38,Taco perfection I go out of my way to go to this place  its always superfast And the order is perfect. I m still stuck on the Doritos taco 5 box Its cheap and comes with a drink . O yah and taco bell  has some  Okay treats . To cap it all off the staff was fff great . This is my taco bell
Taco Bell,39,I have never in my life gone to a restaurant were no  one was willing to help customers. This location closed early without anything being posted. There were employees there but they wouldn t help anyone. This is the worst place I have been and they obviously don t care if they are in business. This place is HORRIBLE. Don t waste your time.
Taco Bell,40,I ve driven off from drive-thru at least 3 times after the person was rude for no reason.  I will not pay a business that is not respecting me and automatically gives me attitude instead of welcoming me.  This is by far the worse Taco Bell around me.  I believe managers should really look at reviews on yelp or any other website and make a change.
Taco Bell,41,Worst service ever was waiting for more than 30 min.Once i finally got my food it looked like shit like a 3 year old  preparing it  i asked for my money back i wasnt going to eat the food it was all messy inside the bag alot of ppl were leaving because they were taking so damn long dont come here they cant run a business that slow.
Taco Bell,42,Not open 24 7 like yelp says it is. I don t partake in. Fast food often so this is definitely a bummer
Taco Bell,43,I ve never been to a fast food place that has superb customer service as this place. Taco Bell is taco bell. Can t expect the food to be 5 stars fresh food. But the service is awesome 
Taco Bell,44,Ok I think I am done with Taco Bell.  Their customer service is absolutely horrible. What these people need to understand is that there is absolutely nothing convenient about their service.  I would almost be willing to pay a little more to get a better customer experience  but their service is so absolutely fucking atrocious  that it behooves me why I keep going back.  I love the taste of their food  but the fact that I cannot even feel secure in the fact that when I have to walk in EVERY fucking time and tell them that they did not get the order right  something is seriously wrong.         So I go through the drive-thru to order 2 bean and cheese burritos  1 mexican pizza without tomatoes  and 2 volcano burrito s with extra meat and 10 fire sauces.  I had repeat myself to the lady taking the order literally 3 times to make sure that they got it correct.  Well the way Taco Bell Drive through works is that they do not give you the actual receipt till they give you the food and it is included into the bag.  I never quite understood that as its not like they are not supplied with computers to help them facilitate the oder.  But for some reason the receipt was never given until the food is given to the customer.  That being said  I paid for the food and of course did not get 10 ft before I found out that they did it again     They put tomatoes on the Mexican Pizza.  On top of that they only gave me 1 bean and cheese burrito  but then again they only charged me for 1 bean and cheese burrito.  So I go into the store and walk up to the counter with the issue.  There was this very heavy set woman going behind the counter when I asked her if she was the one that I spoke to over the comm.  Her reply was   Do I look like I am wearing a headset    I said   Fair enough  and I asked for the person I was speaking to at.  She came out  and she really didn t say much as I was pretty heated at the time.   The cashier came out  looked onto the receipt and advised me that I never placed the 2nd burrito order.  Also that their sauce on the Mexican pizza comes with tomatoes into the sauce  which BTW when we ordered it without tomatoes  and the fucking sauce did not come with it in it.  Either way he took the pizza back and made another one without any sauce at all.  I mean no sauce    Then they gave me an extra bean and cheese burrito and did not charge me for it which was fine  but the fact that they got the order wrong every time is just absolutely baffling.  I mean even based on statistics  they would have had to get it right once maybe every 10 times or so.  That is just not the case.   On top of that they took the receipt from me so I had a serious time just complaining about it.      So my wife calls when I get back as I was so pissed off about it  that it was best that she call.  She gets the manager who states that there was no person that came in to complain today to them about this.  It s not like I did not even exist and was refusing to give the number of his supervisor  but at the end of the call we were able to obtain it.  My wife spoke to Eddie who was the supervisor over the store and explained the circumstance  which in the end he just wanted to provide us with free food.  When we complain about something  we do not ask for free food based on the fact that it feels that we get something for nothing.  So she politely declined and explained that when we complain about service  it is not about free food  it is about the customer experience that went so horribly awry  that we felt that we had no other option but to complain to someone about this experience that can do something to change this.  But to be honest  I do not feel that anything in the end will ever change with Taco Bell.  I know it is Mexican food  but the fact that they cannot get one person that can understand or comprehend mathematics or english for that matter is amazing to me.  I apologize that I force them to pull out the ESL  English as a second language  courses  but what is the point when they work in a predominantly English speaking country and cannot comprehend the use of the numeric system in English or what you are actually saying except for key words.  It creates a language barrier as well as a poor customer experience overall.  I hate even bringing up the language barrier  but if there is one in a country where people are supposed to understand English  than why is this happening       I am so fucking done with Taco Bell in Texas.  I love the taste of the food but the serious lack of customer service as well as the lack of consistency from store to store is just horrific.
Taco Bell,45,Okay  so I have to admit something here. I don t usually eat this much fast food but I live with my girlfriend and she...she decided we should have some time apart. I know this isn t the place to talk about this but half the people in my office have been sick or something...I don t know but I don t really have many friends. I have trouble with people and I thought that Clara udnerstood me but I don t know if that is going to work out and I don t know what to do.  Anyway Clara would do all the cooking and so I m eating out alot now. So yesterday for lunch I went to Taco Bell on Anderson. I generally really like this place and have gone several times. But yesterday I went in and it was completely empty. There was not a sole there. There were cars in the parking lot but no one at the tables or behind the counter or in the bathroom. I stood there for 15 minutes  I could have gone in the back and made my own darn chicken gordita    Anyway I went back to  work and ate some peanut butter in the break room. I thought about going back to that Mcdonalds with that kid in the bathroom because I m starting to get an infectoin but things have been wierd lately. It feels like people haven t been showing up to life lately  you know 
Taco Bell,46,Drive thru was incredibly slow. It litterly took 30 mins after ordering to get up to the window. And by the time I got the food it was cold  I sent a complaint but got no feedback. I find it funny that I was sitting by the back window long enough to read the managers comments to the team on the back office door that said they have 0 speed
Three B's Tacos,1,I make it my mission to visit this food truck whenever I m in Austin. The tacos are  delicious and reasonably priced. There s something about getting them from a truck on the side of the road that s charming
Three B's Tacos,2,The food was barely edible. Cold shredded cheese  miniscule shrimp  similar to what you d get in a top ramen cup   flavorless  lukewarm. I was really hungry but tossed over half because I was concerned about getting sick.
Three B's Tacos,3,Over priced . The food taste like everything is store bought and served straight out of the packaging . I would not recommend this food truck at all .
Three B's Tacos,4,I am astounded to see the favorable reviews. Maybe the management turned the truck over to a third party during SXSW  The prices are all suspiciously missing from the menu. They are price-gouging  I know it is SXSW but COME ON   and they don t warn you before they take your money that they are out of most of the stuff you want. They just substitute or omit the food and not offer a refund. They charged me extra for a brisket taco and then gave me a chicken taco. I was tired of arguing with them at that point  which I had to do at the top of my lungs because the generator makes it very noisy. I am seriously turned off of taco trucks after this experience.
Three B's Tacos,5,Worst decision I have ever made during SXSW. Food is disgusting  not what I ordered and paid for  and overpriced. Avoid.
Three B's Tacos,6,Not that good. They were ok and food was very minimal for price. If I m paying over  3 for taco I expect it to be filling or have enough meat and toppings.
Three B's Tacos,7,Their truck came to my apartment complex and I absolutely loved the delicious brisket sliders and the potato salad    I was excited to hear that they also do nachos and tacos... I ll have to make my way over to their stationary spot and grab some 
