restaurant_name,number,review
Taqueria La Guera,1,I usually eat at  2 off Oltorf St. but the food is better than most restaurants and trucks.
Taqueria La Guera,2,Tiny trailer. Tex-Mex food. Cash only. Red sauce is HOT  Tripas were OK and so was the potato and chorizo taco. The number of selections was impressive. If I am in the area again I may drop in. Lots of Tex-Mex food in this area compete with each other.
Taqueria La Guera,3,WoW  My neighbor mentioned this place coming back from HEB and I am so glad he did. My neighbor got the burrito  which looked immense considering the  7. I had been craving a Torta and was happy. What a hidden gem  There seems to be a widely varied menu to choose from. The food was fast and the people friendly. Can t wait to go back.
Taqueria La Guera,4,Wow. We picked a random taco truck on the site of the road  and I m glad we did. 4 tacos for  7  not pictured are the cactus and egg taco and the chorizo and egg taco . Everything was freshly cooked and delicious. And the salsas were
Taqueria La Guera,5,My dad and I both got chorizo  amp  potato and egg  amp  bacon. Very delicious  quick service  great salsa. Will be back 
Las Palapas,1,A much needed good fast casual Tex-Mex restaurant in the Four Points area. My prayers have been answered.   The Puffy Tacos are outstanding. Homemade puffy corn tortillas stuffed with delicious picadillo beef. Cooked to perfection and tasty.   The hot sauce and queso are spot on. You could dine on this alone.   Anxious to come back and try other dishes but so far this hits all the marks for simple  good  fast Tex Mex.   Service was friendly and prompt.
Las Palapas,2,I have had the pleasure of eating at a number of Los Palapas locations in the San Antonio area. I have always been very happy with the food and the service.  This Austin location is a franchise and has had a difficult time getting opened up. Now they are open for drive-thru service most every day of the week and dining service in the afternoons a couple of days a week. While dining there this afternoon we were told that the problem has been with Staffing shortages.  My dining partner and I were both very happy with our choices and enjoyed our experience at Las Palapas near the intersection of 620 and 2222.   Each of us had a cup of chicken tortilla soup which was a very good. I ate a plate of two Puffy Tacos with ground beef in them and my partner had an ala carte shrimp taco and a puffy taco.  We will both be back and will likely try breakfast once they open up for early morning hours. Their menu is extensive and the food is good.
Las Palapas,3,This place has only been open at this location for about a week.  We were here for breakfast.  I had the breakfast chalupa plate.  It comes with two chalupas topped with your choice of eggs  beans  lettuce  tomatoes  avocado  and cheese.  It was very  very good.  The plate comes with homemade corn tortillas or flour tortillas.  We chose the corn.  The tortillas were fresh  steaming hot  and delicious.  I also had the chorizo and egg breakfast taco.  It was delicious too.  My hubby had the bacon and egg plate.  It comes with two eggs  three thick slices of bacon  potatoes and beans  and tortillas.  He said it was very good.    We will certainly come back  
Las Palapas,4,Had their chips and queso. Chicken and shrimp tacos. They were both really good. The size of the shrimp was big. Thought the whole meal was really good and filling. Shrimp well seasoned  the chicken was juicy  I feel like it was chicken thighs. But I could be wrong. Really good  I ll be back again.
Las Palapas,5,Great big tv to watch the game. I had the LP Breakfast and it s was amazing    Bloody Mary was spot on.
Las Palapas,6,Very disappointed  Waited months for this place to open  every time I would stop by it was close early. We finally got to come in for the first time and the place looked pretty good I love the restroom sink finally a normal sink  Service was good from the young lady that delivered our food.. waiter was ok a lil rushy... unfortunately the food was awful  everything was cold.. cheese was not melted in my enchilada and I ve never ate queso I didn t like .. that was soo strange. Unfortunately we will probably not be returning.. I rather eat Taco Cabana.
Las Palapas,7,Excellent  amp  delicious food  homemade tortillas  Margaritas   amp  service     Finally some real Mexican food.
Las Palapas,8,First time here. Started out on a very high note with the wonderful young lady in the drive-thru. She has fantastic customer service skills. Very friendly and great smile. You don t get that anymore. Food was fresh and tasted good. Tortillas were soooooo good  I m anxious to try several different dishes at this place. Especially breakfast.
Las Palapas,9,My husband and I walked in around lunch time. They were not very busy. We were not acknowledged at all  not even a greeting. After my husband approached an employee  someone came and said  that lady will be with you shortly ...we waited a few more minutes and walked out. A simple greeting goes a long way and they didn t even do that. So they lost business today.
Taquizas Mariana,1,Like most people in Austin  I have a deep love for tacos. But unlike most people who live here  I grew up a hop  skip  jump away from the border so I  know  tacos. Last night  we went to a 50th birthday party that ended up revealing to me that I can actually find border style tacos in Austin... and they come to you.  Taquizas Mariana had a setup there. A plancha style affair with a trompo spit  tiny corn tortillas  fresh salsas  pollo  bistek  and helotes. I felt like the proprietor - Mariana - and I were besties at the end of the night but I d also had a lot of tequila. What I do know for sure is that the food was amazing. I had 6 tacos and an entire corn on the cob and the only reason I didn t go back because I was too damn full. But I wanted to. I wanted to grab the spit and run and make pastor tacos for the rest of the week. She said she ll make whatever - mole  lengua  menudo  etc.   I don t want to write this because it likely means that everyone else will discover how great she is but I also want to keep finding her at backyard parties like some kind of delightful surprise.
Taquizas Mariana,2,Mariana Taquizas was AMAZING  The variety of different tacos  salsas  and  Aguas frescas were a hit  The cactus sales was so delicious  Thank you for making our baby shower a success with such tasty food and great customer service   I will definitely recommend y all and use you again.  Thank you    Veronica
Taquizas Mariana,3,They were over one hour late and our guests were hungry.  But The tacos and quesadillas were deliciouso.  My guests kept going back for more .  And the portions where good...... plus they have a reasonable prices .
Taquizas Mariana,4,Went from CA to a party where these people were contracted  they were 2 hrs late  everyone was starving and to top it off when food was  ready  tacos meat was frozen  quesadillas burned but cheese was cold unmelted  and raw. They were supposed to serve 50 people  we were less than the 50 present at the party and barely half were served rice and beans. My table and the one next to ours didn t get rice or beans because food was not enough   My kids who are not picky with food and were starving just tried it and didn t want to eat  at least beans and rice would ve been enough if there had been any. HOW EXPENSIVE CAN BEANS AND RICE BE . Avoid them unless you want your guests to go buy fast food  want mediocre service and food poisoning.
Taquizas Mariana,5,We requested their catering services for my daughter s graduation. They arrived on time and got to work setting up and cooking  we were eating in 30 minutes. The food was fantastic. Just like a traditional Mexican taco stand. We have eaten in many parts of Mexico and this is honestly mexican food  carne de pollo  bistec  y carne de al pastor with all the fixings. Great salsas  different levels of spiciness. And even aguas frescas with little pieces of fruit  Loved them  Saved their number in my phone   Will 100  use them again 
Taquizas Mariana,6,I just can t say enough about Mariana and her husbands delicious cooking    I found her here on yelp. I was a little wary seeing she just had one review but i was mind blown   We hired them for our rehearsal back yard party which I must add was 90  family from Mexico. Which means I needed the best of the best tacos Texas has to offer. My family from out of town were impressed and even went for seconds  I definitely recommend this family owned business for your next party  Call Mariana 
Taquizas Mariana,7,Plain and simple  everything was delicious. She had everything set up well  food tasted good. The aguas were great. Hire her for your next event.  Todo estaba delicioso   
Taquizas Mariana,8,Best tacos in the round rock austin area  Great service and the workers are so friendly  Cant wait for my next party to call these guys  5 stars.
Taquizas Mariana,9,This was THE BEST catering experience ever  The Taco Stand brought over was amazing. Marianas sons came over and set up everything and cooked everything fresh. They had different jugs of juices  pineapple  horchata and lemonade. They had different toppings for the tacos and different salsas  The meats were delicious  they brought over  trompo pork   steak and chicken. I had family visit  from Mexico and they were raving about the taste and authenticity of these tacos. The guys took care of everything the set up  they brought plates and napkins and cups. If you need a taco stand at any party or wedding HIRE THEM  SO GOOD 
Taquizas Mariana,10,I am glad to see others had better experiences than me. The reason for my 1 star  They showed up 1 hour late to our planned event  This was a big deal and a very special event  Mariana s communication was very poor  I thought she would be the one helping at the event and had no idea that she would be sending other people on her behalf  she never mentioned that to me . I found out the day of the event when I called her  after no one showed up  and she told me her team was on the way. To my disappointment  when they did not show up 30 minutes later  I called again but she never answered. I texted her and asked her for a discount for the inconvenience but she never responded to my text either. I voiced my concerns with her team after they finally showed up and they apologized  they were scheduled for 1 hour later than what I had discussed with Mariana by phone and text  but Mariana never bothered to text me back. I am very disappointed in her communication style and her customer service.   To be fair  the food and service of the team that came to host us was good. The guys were very nice and stayed an extra hour to make up for lost time.   Unfortunately  I will not recommend her due to her lack of communication  and to her ignoring not responding to my text. Customer service was very poor.
Taquizas Mariana,11,AWESOME TACOS    I was stressing on finding a good taco truck for my little boy Baptism  amp  happened to find Mariana on here  amp  I just trusted the reviews. We are all 100  Mexican so we are very picky on good authentic tacos and let me tell you the trompo  bistec   amp  barbacoa were AMAZING. Aguas frescas  amp  salsas were on POINT   Super duper recommend service is amazing  amp  very friendly
Chicanas Tacos,1,The wait at Jiffy Lube was long so decided to try this taco stand that opened across the street a couple of months back. I live a few blocks from here so I notice new things come up and a food cart in North Campus   Hyde Park is pretty rare.  The food is really quite cheap   1.50 breakfast tacos   2 lunch tacos  and a few things such as quesadillas a little bit more but all less than  4 .   I ordered a chicken fajita taco   2  and a potato breakfast taco   1.50  with the 50 cent cent tip came out to just  4. Both tacos were on flour and I opted to get lettuce and tomatoes on the chicken taco. The chicken fajita taco and salsa were mediocre pretty mediocre. The chicken didn t taste that fresh although the tortilla and vegetables were fresh. The included salsa  one a green sauce and one a red sauce were also not particularly flavorful although both were spicy  even for someone that indulges in spicy food pretty regularly. However  the breakfast potato taco was excellent. The potatoes and cheese tasted fresh and the tortilla had the same fluffy  chewy quality of the one used in the chicken fajita taco. Luckily for me  these breakfast tacos are served all day.  I definitely recommend stopping by  especially if you live in the area  are looking for cheap eats  or like Mexican food. Also please note unlike some of the food carts  although like most of them   this place is cash only but it should be easy to scrounge up some cash for this place given its price.
Chicanas Tacos,2,Chicanas has set up shop on 38th and Guadalupe  and it is very distinguishable  what with its plain white cart and bright yellow sign. Plus  there is not much in the way of food carts in this neck of the woods. The menu is simple  boasting meat-laden tacos during lunch and breakfast tacos all the day long.  Chicanas was not all that bad  but I just felt like it incited somewhat of a perversion of the homemade appeal of getting a nitty-gritty taco off of a mobile eatery. To explain  I must go deep into the truck.  I looked into the truck and saw Hill Country Fare  for those who know HEB  you will quickly recognize this as the  house  brand  refried beans. First red flag  canned refried beans. The other mark of mediocrity was the microwave. My tortillas were microwaved  when I at least would have preferred some toasting on a skillet. Alas  I can t have it all...  The taco-based grub is pretty good here  but if you are around this part of town thirsting for some quality  though maybe not authentic  fare  you may just want to head over to the haunt in proximity to 42nd and Lamar. This joint is not specifically desirable  though you could eat here if you wanted to avoid paying a pretty penny.
Chicanas Tacos,3,Amazing salsa and breakfast tacos. Takes about 5 minutes. Not long at all. Made to order takes time. Huge portions  3 tacos for 4 bucks is a no brainier.
Chicanas Tacos,4,The food here was great  with one exception  I definitely plan to return. I ordered three tacos  chorizo and egg   1.50   chicken fajita   2   and pastor taco   2 .  You re given a choice of flour or corn tortilla.    The chorizo and egg was great. I was pleasantly surprised that cheese was included.  The egg was fluffy and there was just the right amount of chorizo to add flavor but not make it too greasy.  I order this with a flour tortilla and it had clearly been heated cooked as well.  It tasted fresh made  but I can t be sure. Very delicious.  The chicken and pastor tacos were prepared in authentic Mexican street style  small pieces of meat with only cilantro  onions  and an optional spicy salsa.  The chicken was flavorful and moist.  The pastor seemed a little overcooked and lacking deep flavor  it didn t seem much like the stewed pastor I m used to  so it s possible there was a mistake and I got the wrong taco. Regardless of what it was  there wasn t enough flavor for me to want to order another in the future.  The woman in the trailer was nice and I thought the food overall was great for the price.  I definitely plan to come back to try more.  If I remember right  they also serve gorditas and tortas  so I ll have to try them as well.
Chicanas Tacos,5,I m glad I ignored the mediocre reviews. Their breakfast tacos are great- they are pretty big  very fresh and  best of all  they have my favorite kind of verde sauce  the sort of creamy and spicy kind. Best of all they are inexpensive and fast. Definitely go here  
Chicanas Tacos,6,Chicken fajita taco was quite good and the salsas were great. My lunch partner got chorizo and pastor and enjoyed them. Got a breakfast taco and both the potato and the bacon were on the raw side and disappointing. This place does not sell drinks whatsoever and the gas station next door has overpriced drinks so cruise over to natural grocers first.
Chicanas Tacos,7,Hilariously  a taco truck is a rare enough thing in Hyde. Thankfully the tacos here are good and fresh. The guys in the truck are salty and not exactly personable. Doesn t really matter though  it s a taco from a truck -- you re not looking for world class customer service. It s reliably very fresh and very good. They re big tacos  overflowing with made to order ingredients. You re gonna have to wait though. Sometimes 20-25 minutes. There is shaded seating but if you re in a hurry  just go elsewhere.
La Traila #6,1,One of the YUMMIEST breakfast tacos  If your by the area you need to try their breakfast tacos I was wanting some food this morning and THANK GOODNESS for this little food truck by my work  I order a bacon egg and cheese taco and a potato egg and cheese both on flour. They were both a good size and nicely stuffed  Their green salsa is so good not spicy at all and I really liked that because I don t do spicy food. But the salsa gave it a nice kick taste with out the spiciness is that makes any sense   Definitely a quick pick up breakfast spot and I m sure I ll be going back. Now I ll need to try their lunch  I ll keep y all posted 
La Traila #6,2,Came here for breakfast and so glad we did  The woman working was super nice and they made the food quickly  The Trojan is huge and so good  I was only able to eat half while there  My husband got the la gringas and they are like quesadillas  so so yummy  This is located in a shell parking lot  can grab a soda from the convenient store  Stop by and get you some good eats 
La Traila #6,3,Excellent tacos  great red salsa  great salsa verde  and horchata. Quick made to order Mexican food. They have nopales for vegetarians.
Quick Fix Cuisine,1,I used to come here almost every other day when the truck was next to the shop . Their food is second to none when it comes to food and taste here in San Marcos. Every thing on their menu is special . You would be satisfied with anything you choose . Service is top tier and the ambiance of a food truck scene is a cool one .
Quick Fix Cuisine,2,I got the birria tacos and oh my goodness 10 10 they were great   I highly recommend getting them
Quick Fix Cuisine,3,The birria tacos were as good as the reviews promised--two tacos packed to the gills with tender  quality meat and a cup of chunky broth and chile oil  i think she referred to is as consomm   it s delicious and looked like stew  to dunk them in and a beautiful little lime to finish. It was more than I could eat in one go but I believe it would fill Mr R on a hungry day  and  13 is fair when you appreciate it was all cooked fresh from quality ingredients and tastes great on your plate.  Similarly  the smoothies contain actual recognizable produce full of goodness and are made when you order. There are 3 sizes depending on your appetite and budget. Very filling   The staff were extremely friendly  polite  and kind. When my juice wasn t ready with my food she brought me a water  and she happily offered to explain how the tacos broth are usually eaten.  I look forward to trying more of their menu in the near future. A twitter post said they ve been in business for four years  impressive even in normal times  food industry is tough  and when you taste their cooking you understand why.
Quick Fix Cuisine,4,I ordered the beef fried rice  Talk about delicious  They use grass fed beef and the cook that cooks here is from Thailand and her recipe is what they serve  it s so good  Not greasy  Packed with flavor  they served it with a peanut sauce and finely chopped peanuts on top  We mainly got it for my daughter so they put most the sauces on the side. I ended up eating it... ALL  lol Hands down best fried rice you ll ever have  And I m telling you  I NEVER order fried rice from anywhere bc I like my own but dang. That was awesome  The staff was super friendly  they give you those feel good vibes  like they ve known you forever  worth the stop  will definitely be coming back  I do want to add this is actually located in the red bus food park on 801 chestnut st. You can buy alcohol from the red bus.
Quick Fix Cuisine,5,The birria tacos are so full of meat and the taco stays crunchy  Also their mango lime juice is delicious  Definitely coming here again.
Quick Fix Cuisine,6,I was so pleased with this great business  we were amazed by the quality of the food  and the customer service provided by Marcus. Him and his partner were super helpful and made sure we were taken care of. He was so kind in dealing with a transaction mistake and was super communicative with us  such a good energy all around. The food was ASTOUNDING and we will absolutely be going back. Thank you for a wonderful night 
Quick Fix Cuisine,7,Literally the best food I ve ever eaten and I cook a lot at home. The owner and her family are amazing. Their business and the care that April takes with quality of their items is unmatched. Fav items on the menu right now are the elote  street corn  and the Pambazo. The juices are amazing too.
Quick Fix Cuisine,8,This place is so good  Birria tacos are excellent and the blueberry lemonade is like nothing you would expect    So good    The owners are super nice too    My husband and I will be making the 2 hour drive to eat here again       And dreaming about the Birria until then 
Quick Fix Cuisine,9,I have to eat GF. Horrid life.  Trying new places but I can tell off the bat if the chefs are knowledgeable. They are MORE than knowledgeable  changed some things on their own so that I could enjoy yumminess. Add in the extreme deliciousness  that combo makes my heart flutter. Will be back for sure 
Quick Fix Cuisine,10,Delicious Birria   Meat is very tender and very flavorful the broth is flavorful as well. Staff is friendly  Definitely coming back and recommend 
Quick Fix Cuisine,11,The Birria tacos go hard as f    man  20 out of 10  It s been a long time since I ve been to a place where the meat and broth have the distinct flavor to the crispy tortilla with cilantro cabbage  onion and cheese. They also serve fresh  amp  tasty beverages instead of the usual fake concentrate juice or powder packets. If you haven t been you should  Because once you try it  YOU WILL WANT TO GO BACK      Great people behind it as well.
Quick Fix Cuisine,12,This place is sooo good  Just landed in Austin  didn t know what I wanted to eat  Luckily came across a bunch of food trucks and that always a good sign for variety and tons of options. There was Cuban  Thai  BBQ...a few more trucks that I can t remember what they were serving BUT I did find myself coming back to Quick Fix..I should ve known since it was first option  I got the SOMALICIOUS  w shrimp  is DELICIOUS    Tasted fresh  the sauce that it comes with has a kick but so good  If they have a bottle of it I d buy it  The drinks are fresh and soooo GOOD     Blueberry cinnamon    not to mention the owners are down to earth and know good healthy food   I definitely will come back   
Quick Fix Cuisine,13,Shrimp and chorizo tacos are fire   Enjoyed every bite  friendly people and great food.
Quick Fix Cuisine,14,Stop by to get some drinks. They are amazing   He offered a taste of their 2 new drinks. They were so good I bought both of them.   Cucumber mint and raspberry cinnamon
Quick Fix Cuisine,15,Great customer service and even better attitude  ingredients. Ordered the birria tacos that come with the consume  and my mouth was already watering just by how they were explaining it. They gave us samples while we waited for our food  and the juices were Incredible. Definitely recommend to anybody that enjoys great street.
Quick Fix Cuisine,16,Quick Fix was so freaking good  April really cares about the quality of her food and the ingredients she uses. The Birria tacos and the pambazo sandwich were amazing  We will definitely be coming back   
Quick Fix Cuisine,17,y all. i have followed this place on facebook for a long while  but finally ordered food from there yesterday.  this. place. is. AMAZING.  i got the chicken fried rice and the pb amp j. everything was so fresh  especially in the fried rice. it wasn t greasy or stale tasting like most fried rices seem to be from other places. the sauces on it made such a  great  difference.  the pb amp j was to have a sweet  amp  because it sparked my interest. when i say the bread on this sandwich was equivalent to the decadence of a good french toast  that would be modest.  give this place a try if you re on the fence - you won t regret it.
Quick Fix Cuisine,18,One of my favorite local food trucks - always fresh and healthy food options. I m not vegan but have tried their vegan tacos and can say they are DELICIOUS
Quick Fix Cuisine,19,We had the most amazing food here. My boyfriend got the tacos with the birria  which was unexpected because we d always seen this on twitter and wanted to try it for ourselves . I had some sweet meat with the rice. We tried their drinks  I got a blueberry one and I think my boyfriend got the one with lime. We absolutely loved our food and our drinks. Please come here and try it out for yourself 
Quick Fix Cuisine,20,Amazing food. They use grass-fed beef which is such a great touch. The owner was there and she was super friendly and informative. Pro tip  order their fresh herb and juice blends 
